{
  "experiment": {
    "id": null,
    "name": "naive_rag_50q",
    "description": "Naive RAG evaluation with FAISS vector store (50 questions)",
    "tags": ["comparison", "naive-rag", "50q"],
    "output_dir": "data/evaluation/rag_comparison"
  },
  "questions": {
    "source": "cached",
    "cache_key": "359312cb043d5a69",
    "comment": "Use same questions for fair comparison with KG RAG"
  },
  "models": {
    "evaluation_targets": [
      {
        "id": "gpt-4o-mini",
        "name": "GPT-4o-mini",
        "provider": "openai",
        "model": "gpt-4o-mini",
        "config": {
          "temperature": 0.7,
          "max_tokens": 1024
        }
      },
      {
        "id": "exaone",
        "name": "EXAONE-3.5-7.8B",
        "provider": "ollama",
        "model": "ollama/exaone3.5:7.8b",
        "config": {
          "api_base": "http://100.95.220.92:11434",
          "temperature": 0.7
        }
      }
    ]
  },
  "retrieval": {
    "method": "naive",
    "k": 4,
    "vector_store_path": "data/vector_store/seoul_traffic",
    "comment": "FAISS vector store with cosine similarity"
  },
  "evaluation": {
    "judge_model": "gpt-5",
    "metrics": ["faithfulness", "answer_relevancy", "answer_correctness", "context_recall"]
  },
  "execution": {
    "checkpoint_interval": 5,
    "verbose": true,
    "dry_run": false
  }
}
